UC-1_Creating Database

mysql> create database AddressBookService;
Query OK, 1 row affected (0.01 sec)

mysql> show databases;
+--------------------+
| Database           |
+--------------------+
| addressbookservice |
| information_schema |
| mysql              |
| performance_schema |
| sakila             |
| sys                |
| up                 |
| world              |
+--------------------+
8 rows in set (0.01 sec)

mysql> use AddressBookService;
Database changed

mysql> create table AddressBook(FirstName varchar(75),LastName varchar(75),Address varchar(125),City varchar(75),State varchar(75),Zip int,
                                  PhoneNo int,Email varchar(75));
Query OK, 0 rows affected (0.06 sec)

mysql> describe AddressBook;
+-----------+--------------+------+-----+---------+-------+
| Field     | Type         | Null | Key | Default | Extra |
+-----------+--------------+------+-----+---------+-------+
| FirstName | varchar(75)  | YES  |     | NULL    |       |
| LastName  | varchar(75)  | YES  |     | NULL    |       |
| Address   | varchar(125) | YES  |     | NULL    |       |
| City      | varchar(75)  | YES  |     | NULL    |       |
| State     | varchar(75)  | YES  |     | NULL    |       |
| Zip       | int          | YES  |     | NULL    |       |
| PhoneNo   | int          | YES  |     | NULL    |       |
| Email     | varchar(75)  | YES  |     | NULL    |       |
+-----------+--------------+------+-----+---------+-------+
8 rows in set (0.02 sec)

UC-3_Insert into database

mysql> insert into AddressBook values("Ajay","Dha","Panvel","Panvel","Mah",123455,4356789,"ajay@.com"),
                                     ("vijay","Dha","Thane","Thane","Mah",345678,76894028,"vijay@.com");
Query OK, 2 rows affected (0.01 sec)
Records: 2  Duplicates: 0  Warnings: 0

UC-4_Edit Existing Contact With First Name

mysql> select * from Addressbook;
+-----------+----------+---------+--------+-------+--------+----------+------------+
| FirstName | LastName | Address | City   | State | Zip    | PhoneNo  | Email      |
+-----------+----------+---------+--------+-------+--------+----------+------------+
| Ajay      | Dha      | Panvel  | Panvel | Mah   | 123455 |  4356789 | ajay@.com  |
| vijay     | Dha      | Thane   | Thane  | Mah   | 345678 | 76894028 | vijay@.com |
+-----------+----------+---------+--------+-------+--------+----------+------------+
2 rows in set (0.00 sec)

mysql> update AddressBook set LastName = "Dhalpe", Address = "Navi Mumbai" where FirstName = "Ajay";
Query OK, 1 row affected (0.01 sec)
Rows matched: 1  Changed: 1  Warnings: 0

mysql> select * from Addressbook;
+-----------+----------+-------------+--------+-------+--------+----------+------------+
| FirstName | LastName | Address     | City   | State | Zip    | PhoneNo  | Email      |
+-----------+----------+-------------+--------+-------+--------+----------+------------+
| Ajay      | Dhalpe   | Navi Mumbai | Panvel | Mah   | 123455 |  4356789 | ajay@.com  |
| vijay     | Dha      | Thane       | Thane  | Mah   | 345678 | 76894028 | vijay@.com |
+-----------+----------+-------------+--------+-------+--------+----------+------------+
2 rows in set (0.00 sec)

UC-5_Delete Existing Contact With First Name

mysql> select * from Addressbook;
+-----------+----------+-------------+--------+-------+--------+----------+------------+
| FirstName | LastName | Address     | City   | State | Zip    | PhoneNo  | Email      |
+-----------+----------+-------------+--------+-------+--------+----------+------------+
| Ajay      | Dhalpe   | Navi Mumbai | Panvel | Mah   | 123455 |  4356789 | ajay@.com  |
| vijay     | Dha      | Thane       | Thane  | Mah   | 345678 | 76894028 | vijay@.com |
+-----------+----------+-------------+--------+-------+--------+----------+------------+
2 rows in set (0.00 sec)

mysql> delete from AddressBook where FirstName = "vijay";
Query OK, 1 row affected (0.01 sec)

mysql> select * from Addressbook;
+-----------+----------+-------------+--------+-------+--------+---------+-----------+
| FirstName | LastName | Address     | City   | State | Zip    | PhoneNo | Email     |
+-----------+----------+-------------+--------+-------+--------+---------+-----------+
| Ajay      | Dhalpe   | Navi Mumbai | Panvel | Mah   | 123455 | 4356789 | ajay@.com |
+-----------+----------+-------------+--------+-------+--------+---------+-----------+
1 row in set (0.00 sec)

UC-6_Retrive contact With City or State 

mysql> select * from Addressbook;
+-----------+----------+-------------+--------+-------+--------+----------+-------------+
| FirstName | LastName | Address     | City   | State | Zip    | PhoneNo  | Email       |
+-----------+----------+-------------+--------+-------+--------+----------+-------------+
| Ajay      | Dhalpe   | Navi Mumbai | Panvel | Mah   | 123455 |  4356789 | ajay@.com   |
| Sanjay    | Dha      | Panvel      | Panvel | Mah   | 123785 |   456789 | sanjay@.com |
| vijay     | Dha      | Thane       | Thane  | Mah   | 345678 | 76894028 | vijay@.com  |
+-----------+----------+-------------+--------+-------+--------+----------+-------------+
3 rows in set (0.00 sec)

mysql> select * from AddressBook where City = "Panvel" And State = "Mah";
+-----------+----------+-------------+--------+-------+--------+---------+-------------+
| FirstName | LastName | Address     | City   | State | Zip    | PhoneNo | Email       |
+-----------+----------+-------------+--------+-------+--------+---------+-------------+
| Ajay      | Dhalpe   | Navi Mumbai | Panvel | Mah   | 123455 | 4356789 | ajay@.com   |
| Sanjay    | Dha      | Panvel      | Panvel | Mah   | 123785 |  456789 | sanjay@.com |
+-----------+----------+-------------+--------+-------+--------+---------+-------------+
2 rows in set (0.00 sec)

mysql> select * from AddressBook where City = "Panvel" Or State = "Mah";
+-----------+----------+-------------+--------+-------+--------+----------+-------------+
| FirstName | LastName | Address     | City   | State | Zip    | PhoneNo  | Email       |
+-----------+----------+-------------+--------+-------+--------+----------+-------------+
| Ajay      | Dhalpe   | Navi Mumbai | Panvel | Mah   | 123455 |  4356789 | ajay@.com   |
| Sanjay    | Dha      | Panvel      | Panvel | Mah   | 123785 |   456789 | sanjay@.com |
| vijay     | Dha      | Thane       | Thane  | Mah   | 345678 | 76894028 | vijay@.com  |
+-----------+----------+-------------+--------+-------+--------+----------+-------------+
3 rows in set (0.00 sec)

UC-7_Size of Addressbook With City or State 

mysql> select count(City And State) from AddressBook;
+-----------------------+
| count(City And State) |
+-----------------------+
|                     3 |
+-----------------------+
1 row in set, 3 warnings (0.00 sec)

UC-8_Sorting Addressbook With City by alpha order by firstName 

mysql> select * from AddressBook where City = "Panvel" order by FirstName ASC;
+-----------+----------+-------------+--------+-------+--------+---------+-------------+
| FirstName | LastName | Address     | City   | State | Zip    | PhoneNo | Email       |
+-----------+----------+-------------+--------+-------+--------+---------+-------------+
| Ajay      | Dhalpe   | Navi Mumbai | Panvel | Mah   | 123455 | 4356789 | ajay@.com   |
| Sanjay    | Dha      | Panvel      | Panvel | Mah   | 123785 |  456789 | sanjay@.com |
+-----------+----------+-------------+--------+-------+--------+---------+-------------+
2 rows in set (0.00 sec)

UC-9_Identify Addressbook With name & Type 

mysql> alter table AddressBook Add Type varchar(75);
Query OK, 0 rows affected (0.04 sec)
Records: 0  Duplicates: 0  Warnings: 0

mysql> update AddressBook set Type = "Family" where FirstName = "Ajay";
Query OK, 1 row affected (0.01 sec)
Rows matched: 1  Changed: 1  Warnings: 0

mysql> update AddressBook set Type = "Friend" where FirstName = "vijay";
Query OK, 1 row affected (0.01 sec)
Rows matched: 1  Changed: 1  Warnings: 0

mysql> update AddressBook set Type = "Family" where FirstName = "Sanjay";
Query OK, 1 row affected (0.01 sec)
Rows matched: 1  Changed: 1  Warnings: 0

mysql> select * from AddressBook;
+-----------+----------+-------------+--------+-------+--------+----------+-------------+--------+
| FirstName | LastName | Address     | City   | State | Zip    | PhoneNo  | Email       | Type   |
+-----------+----------+-------------+--------+-------+--------+----------+-------------+--------+
| Ajay      | Dhalpe   | Navi Mumbai | Panvel | Mah   | 123455 |  4356789 | ajay@.com   | Family |
| Sanjay    | Dha      | Panvel      | Panvel | Mah   | 123785 |   456789 | sanjay@.com | Family |
| vijay     | Dha      | Thane       | Thane  | Mah   | 345678 | 76894028 | vijay@.com  | Friend |
+-----------+----------+-------------+--------+-------+--------+----------+-------------+--------+
3 rows in set (0.00 sec)

UC-10_Count by Type 

mysql> select count(FirstName) from AddressBook group by Type = "Family";
+------------------+
| count(FirstName) |
+------------------+
|                2 |
|                1 |
+------------------+
2 rows in set (0.00 sec)

mysql> select Type,count(Type) from AddressBook where Type = "Family" group by Type;
+--------+-------------+
| Type   | count(Type) |
+--------+-------------+
| Family |           2 |
+--------+-------------+
1 row in set (0.00 sec)

mysql> select Type,count(Type) from AddressBook group by Type;
+--------+-------------+
| Type   | count(Type) |
+--------+-------------+
| Family |           2 |
| Friend |           1 |
+--------+-------------+
2 rows in set (0.00 sec)

UC-11_Add person to both Family & Friend

mysql> insert into AddressBook values("Ajay","Dhalpe","Navi Mumbai","Panvel","Mah",123455,4356789,"ajay@.com","Friend");
Query OK, 1 row affected (0.01 sec)

mysql> select * from AddressBook;
+-----------+----------+-------------+--------+-------+--------+----------+-------------+--------+
| FirstName | LastName | Address     | City   | State | Zip    | PhoneNo  | Email       | Type   |
+-----------+----------+-------------+--------+-------+--------+----------+-------------+--------+
| Ajay      | Dhalpe   | Navi Mumbai | Panvel | Mah   | 123455 |  4356789 | ajay@.com   | Family |
| Sanjay    | Dha      | Panvel      | Panvel | Mah   | 123785 |   456789 | sanjay@.com | Family |
| vijay     | Dha      | Thane       | Thane  | Mah   | 345678 | 76894028 | vijay@.com  | Friend |
| Ajay      | Dhalpe   | Navi Mumbai | Panvel | Mah   | 123455 |  4356789 | ajay@.com   | Friend |
+-----------+----------+-------------+--------+-------+--------+----------+-------------+--------+
4 rows in set (0.00 sec)

UC-12_creating multiple tables

create table person_contact_details(person_id int primary key not null auto_increment,first_name varchar(75),last_name varchar(75),
                                    phone_no bigint,email varchar(75));

mysql> insert into person_contact_details values(2,"Sanjay","Dha",6746758479,"sanjay4@gm.com"),(3,"Vijay","Dha",234444555,"Sanjayjfj@hf.com");
Query OK, 2 rows affected (0.01 sec)
Records: 2  Duplicates: 0  Warnings: 0

mysql> select * from person_contact_details;
+-----------+------------+-----------+------------+------------------+
| person_id | first_name | last_name | phone_no   | email            |
+-----------+------------+-----------+------------+------------------+
|         1 | Ajay       | Dhalpe    | 6746758478 | ajay4@gm.com     |
|         2 | Sanjay     | Dha       | 6746758479 | sanjay4@gm.com   |
|         3 | Vijay      | Dha       |  234444555 | Sanjayjfj@hf.com |
+-----------+------------+-----------+------------+------------------+
3 rows in set (0.00 sec)


mysql> create table person_address_details(address varchar(75),city varchar(75),state varchar(75),zip int,person_id int,foreign key (person_id) references person_contact_details(person_id));
Query OK, 0 rows affected (0.08 sec)

mysql> insert into person_address_details values("Navi Mumbai","Panvel","Mah",76457,1),("Panvel","Panvel","Mah",785648,2),("Thane","Thane","Mah",7564875,3);
Query OK, 3 rows affected (0.01 sec)
Records: 3  Duplicates: 0  Warnings: 0

mysql> select * from person_address_details;
+-------------+--------+-------+---------+-----------+
| address     | city   | state | zip     | person_id |
+-------------+--------+-------+---------+-----------+
| Navi Mumbai | Panvel | Mah   |   76457 |         1 |
| Panvel      | Panvel | Mah   |  785648 |         2 |
| Thane       | Thane  | Mah   | 7564875 |         3 |
+-------------+--------+-------+---------+-----------+
3 rows in set (0.00 sec)


mysql> create table person_address_type(address_type varchar(75),person_id int,foreign key (person_id) references person_contact_details(person_id));
Query OK, 0 rows affected (0.07 sec)

mysql> insert into person_address_type values("Family",1),("Family",2),("Friend",3);
Query OK, 3 rows affected (0.01 sec)
Records: 3  Duplicates: 0  Warnings: 0

mysql> select * from person_address_type;
+--------------+-----------+
| address_type | person_id |
+--------------+-----------+
| Family       |         1 |
| Family       |         2 |
| Friend       |         3 |
+--------------+-----------+
3 rows in set (0.00 sec)



