UC-1_Creating Database

mysql> create database AddressBookService;
Query OK, 1 row affected (0.01 sec)

mysql> show databases;
+--------------------+
| Database           |
+--------------------+
| addressbookservice |
| information_schema |
| mysql              |
| performance_schema |
| sakila             |
| sys                |
| up                 |
| world              |
+--------------------+
8 rows in set (0.01 sec)

mysql> use AddressBookService;
Database changed

mysql> create table AddressBook(FirstName varchar(75),LastName varchar(75),Address varchar(125),City varchar(75),State varchar(75),Zip int,PhoneNo int,Email varchar(75));
Query OK, 0 rows affected (0.06 sec)

mysql> describe AddressBook;
+-----------+--------------+------+-----+---------+-------+
| Field     | Type         | Null | Key | Default | Extra |
+-----------+--------------+------+-----+---------+-------+
| FirstName | varchar(75)  | YES  |     | NULL    |       |
| LastName  | varchar(75)  | YES  |     | NULL    |       |
| Address   | varchar(125) | YES  |     | NULL    |       |
| City      | varchar(75)  | YES  |     | NULL    |       |
| State     | varchar(75)  | YES  |     | NULL    |       |
| Zip       | int          | YES  |     | NULL    |       |
| PhoneNo   | int          | YES  |     | NULL    |       |
| Email     | varchar(75)  | YES  |     | NULL    |       |
+-----------+--------------+------+-----+---------+-------+
8 rows in set (0.02 sec)

UC-3_Insert into database

mysql> insert into AddressBook values("Ajay","Dha","Panvel","Panvel","Mah",123455,4356789,"ajay@.com"),
                                     ("vijay","Dha","Thane","Thane","Mah",345678,76894028,"vijay@.com");
Query OK, 2 rows affected (0.01 sec)
Records: 2  Duplicates: 0  Warnings: 0

UC-4_Edit Existing Contact With First Name

mysql> select * from Addressbook;
+-----------+----------+---------+--------+-------+--------+----------+------------+
| FirstName | LastName | Address | City   | State | Zip    | PhoneNo  | Email      |
+-----------+----------+---------+--------+-------+--------+----------+------------+
| Ajay      | Dha      | Panvel  | Panvel | Mah   | 123455 |  4356789 | ajay@.com  |
| vijay     | Dha      | Thane   | Thane  | Mah   | 345678 | 76894028 | vijay@.com |
+-----------+----------+---------+--------+-------+--------+----------+------------+
2 rows in set (0.00 sec)

mysql> update AddressBook set LastName = "Dhalpe", Address = "Navi Mumbai" where FirstName = "Ajay";
Query OK, 1 row affected (0.01 sec)
Rows matched: 1  Changed: 1  Warnings: 0

mysql> select * from Addressbook;
+-----------+----------+-------------+--------+-------+--------+----------+------------+
| FirstName | LastName | Address     | City   | State | Zip    | PhoneNo  | Email      |
+-----------+----------+-------------+--------+-------+--------+----------+------------+
| Ajay      | Dhalpe   | Navi Mumbai | Panvel | Mah   | 123455 |  4356789 | ajay@.com  |
| vijay     | Dha      | Thane       | Thane  | Mah   | 345678 | 76894028 | vijay@.com |
+-----------+----------+-------------+--------+-------+--------+----------+------------+
2 rows in set (0.00 sec)

UC-5_Delete Existing Contact With First Name

mysql> select * from Addressbook;
+-----------+----------+-------------+--------+-------+--------+----------+------------+
| FirstName | LastName | Address     | City   | State | Zip    | PhoneNo  | Email      |
+-----------+----------+-------------+--------+-------+--------+----------+------------+
| Ajay      | Dhalpe   | Navi Mumbai | Panvel | Mah   | 123455 |  4356789 | ajay@.com  |
| vijay     | Dha      | Thane       | Thane  | Mah   | 345678 | 76894028 | vijay@.com |
+-----------+----------+-------------+--------+-------+--------+----------+------------+
2 rows in set (0.00 sec)

mysql> delete from AddressBook where FirstName = "vijay";
Query OK, 1 row affected (0.01 sec)

mysql> select * from Addressbook;
+-----------+----------+-------------+--------+-------+--------+---------+-----------+
| FirstName | LastName | Address     | City   | State | Zip    | PhoneNo | Email     |
+-----------+----------+-------------+--------+-------+--------+---------+-----------+
| Ajay      | Dhalpe   | Navi Mumbai | Panvel | Mah   | 123455 | 4356789 | ajay@.com |
+-----------+----------+-------------+--------+-------+--------+---------+-----------+
1 row in set (0.00 sec)

UC-6_Retrive contact With City or State 

mysql> select * from Addressbook;
+-----------+----------+-------------+--------+-------+--------+----------+-------------+
| FirstName | LastName | Address     | City   | State | Zip    | PhoneNo  | Email       |
+-----------+----------+-------------+--------+-------+--------+----------+-------------+
| Ajay      | Dhalpe   | Navi Mumbai | Panvel | Mah   | 123455 |  4356789 | ajay@.com   |
| Sanjay    | Dha      | Panvel      | Panvel | Mah   | 123785 |   456789 | sanjay@.com |
| vijay     | Dha      | Thane       | Thane  | Mah   | 345678 | 76894028 | vijay@.com  |
+-----------+----------+-------------+--------+-------+--------+----------+-------------+
3 rows in set (0.00 sec)

mysql> select * from AddressBook where City = "Panvel" And State = "Mah";
+-----------+----------+-------------+--------+-------+--------+---------+-------------+
| FirstName | LastName | Address     | City   | State | Zip    | PhoneNo | Email       |
+-----------+----------+-------------+--------+-------+--------+---------+-------------+
| Ajay      | Dhalpe   | Navi Mumbai | Panvel | Mah   | 123455 | 4356789 | ajay@.com   |
| Sanjay    | Dha      | Panvel      | Panvel | Mah   | 123785 |  456789 | sanjay@.com |
+-----------+----------+-------------+--------+-------+--------+---------+-------------+
2 rows in set (0.00 sec)

mysql> select * from AddressBook where City = "Panvel" Or State = "Mah";
+-----------+----------+-------------+--------+-------+--------+----------+-------------+
| FirstName | LastName | Address     | City   | State | Zip    | PhoneNo  | Email       |
+-----------+----------+-------------+--------+-------+--------+----------+-------------+
| Ajay      | Dhalpe   | Navi Mumbai | Panvel | Mah   | 123455 |  4356789 | ajay@.com   |
| Sanjay    | Dha      | Panvel      | Panvel | Mah   | 123785 |   456789 | sanjay@.com |
| vijay     | Dha      | Thane       | Thane  | Mah   | 345678 | 76894028 | vijay@.com  |
+-----------+----------+-------------+--------+-------+--------+----------+-------------+
3 rows in set (0.00 sec)